{"commit":"0123456789abcdef0123456789abcdef01234567","alphaPosture":"alpha-early-access","runtime":{"node":"24.12.0","pnpm":"9.15.4","lockHash":"0123456789abcdef0123456789abcdef0123456789abcdef0123456789abcdef"},"inputs":{"composeDigest":"sha256:0123456789abcdef0123456789abcdef0123456789abcdef0123456789abcdef"},"images":[{"tag":"deploylite:test","digest":"sha256:0123456789abcdef0123456789abcdef0123456789abcdef0123456789abcdef","platform":"linux/amd64","buildId":"ci-1"}],"checks":[{"name":"scan","result":"exception","exceptionId":"SCAN-1","command":"scan","artifact":"artifacts/scan.txt","timestamp":"2026-07-18T00:00:00.000Z"}],"exceptions":[{"id":"SCAN-1","component":"scanner","owner":"security","rationale":"test","compensatingControl":"review","reviewer":"reviewer","evidence":"artifacts/scan.txt","expiresAt":"2020-01-01T00:00:00.000Z"}],"smoke":{"status":"pending","target":"not-run"},"review":{"reviewer":"release-reviewer","approvalLocation":"reviews/pr-84"},"artifacts":["artifacts/scan.txt"]}
