{"commit":"0123456789abcdef0123456789abcdef01234567","alphaPosture":"alpha-early-access","runtime":{"node":"24.12.0","pnpm":"9.15.4","lockHash":"0123456789abcdef0123456789abcdef0123456789abcdef0123456789abcdef"},"inputs":{"composeDigest":"sha256:0123456789abcdef0123456789abcdef0123456789abcdef0123456789abcdef"},"images":[{"tag":"deploylite:test","digest":"sha256:0123456789abcdef0123456789abcdef0123456789abcdef0123456789abcdef","platform":"linux/amd64","buildId":"ci-1"}],"checks":[{"name":"policy","result":"pass","command":"bash scripts/support-policy.test.sh","artifact":"artifacts/policy.txt","timestamp":"2026-07-18T00:00:00.000Z"}],"exceptions":[],"smoke":{"status":"pending","target":"not-run"},"review":{"reviewer":"release-reviewer","approvalLocation":"reviews/pr-84"},"artifacts":["artifacts/policy.txt"]}
